{
  "$schema": "./protocols.schema.json",
  "format": "cognium-a11y-human-protocols",
  "format_version": "1.0.0",
  "result_vocabulary": [
    "pass",
    "fail",
    "inapplicable",
    "cannot-tell",
    "not-tested"
  ],
  "privacy": {
    "fixture_data": "public-synthetic-only",
    "participant_data": "prohibited",
    "production_evidence": "prohibited"
  },
  "protocols": [
    {
      "id": "screen-reader-task",
      "version": "1.0.0",
      "title": "Screen-reader task interoperability",
      "lane": "at-interoperability",
      "fixture_ids": [
        "guided-at_screen_reader_task",
        "journey-booking-broken",
        "journey-booking-correct"
      ],
      "prerequisites": [
        "Use a clean profile and a supported product-browser pairing.",
        "Know the normal reading, navigation, forms and interaction commands for the chosen pairing.",
        "Run only against the public synthetic fixture host and reset the booking journey before each review."
      ],
      "environment": {
        "required_fields": [
          "tool",
          "tool_version",
          "browser",
          "browser_version",
          "platform",
          "platform_version",
          "settings",
          "input_method"
        ],
        "pairing_options": [
          {
            "id": "jaws-windows-browser",
            "tool": "JAWS",
            "platform": "Windows",
            "browser": "Record the exact supported browser",
            "input_method": "screen-reader keyboard commands",
            "scope_note": "The result applies only to the recorded JAWS, browser and platform versions."
          },
          {
            "id": "nvda-windows-browser",
            "tool": "NVDA",
            "platform": "Windows",
            "browser": "Record the exact supported browser",
            "input_method": "screen-reader keyboard commands",
            "scope_note": "The result applies only to the recorded NVDA, browser and platform versions."
          },
          {
            "id": "voiceover-apple-browser",
            "tool": "VoiceOver",
            "platform": "Record macOS or iOS and its exact version",
            "browser": "Record the exact browser",
            "input_method": "VoiceOver commands for the recorded device",
            "scope_note": "Desktop and mobile VoiceOver results are distinct and cannot be substituted for each other."
          },
          {
            "id": "talkback-android-chrome",
            "tool": "TalkBack",
            "platform": "Android",
            "browser": "Chrome",
            "input_method": "TalkBack touch and gesture commands",
            "scope_note": "Record device, Android, TalkBack and Chrome versions; do not generalize beyond them."
          }
        ]
      },
      "steps": [
        {
          "id": "sr-01",
          "action": "Open the declared journey entry and identify the page title, main heading and task start without visual assistance.",
          "expected_observation": "The reviewer can locate the task and distinguish page structure using the chosen pairing.",
          "evidence": "Record the announced title and heading order as a transcript or structured note."
        },
        {
          "id": "sr-02",
          "action": "Complete every declared booking step using only the chosen screen-reader commands.",
          "expected_observation": "Controls expose usable names, roles, values, state changes and error or status feedback throughout the task.",
          "evidence": "Record each blocker, unexpected announcement and successful state transition by step ID."
        },
        {
          "id": "sr-03",
          "action": "Repeat the same journey with the matched corrected fixture and compare only within the recorded pairing.",
          "expected_observation": "The control is independently evaluated; a result from one pairing is not copied to another.",
          "evidence": "Capture separate outcomes for the broken and corrected fixture IDs."
        }
      ],
      "expected_observations": [
        "Task completion and barriers are reported per pairing, not as universal product claims.",
        "Announcements, navigation order, state changes and completion are observable in the evidence."
      ],
      "stop_conditions": [
        "Stop if navigation leaves the public synthetic host or requests real account, payment or identity data.",
        "Stop if the reviewer loses control of focus, audio or device operation in a way that cannot be safely reset.",
        "Pause on discomfort or fatigue and mark remaining steps not-tested."
      ],
      "evidence_requirements": [
        "Pseudonymous reviewer ID and exact pairing versions.",
        "Step-level outcome, observation and evidence digest or public-synthetic note.",
        "Separate result records for each pairing and fixture variant."
      ]
    },
    {
      "id": "keyboard-task",
      "version": "1.0.0",
      "title": "Keyboard-only task operation",
      "lane": "human-guided",
      "fixture_ids": [
        "guided-focus_order_meaning",
        "scenario-keyboard_trap",
        "scenario-safe_keyboard_trap",
        "journey-booking-broken",
        "journey-booking-correct"
      ],
      "prerequisites": [
        "Use a clean browser profile at the protocol default display settings.",
        "Disconnect or set aside pointing input for the duration of the run.",
        "Reset the fixture to its declared entry and default state."
      ],
      "environment": {
        "required_fields": ["tool", "tool_version", "browser", "browser_version", "platform", "platform_version", "settings", "input_method"],
        "pairing_options": []
      },
      "steps": [
        {
          "id": "key-01",
          "action": "Traverse the task using Tab, Shift+Tab and documented native keys only.",
          "expected_observation": "Every required control is reachable in an order that preserves meaning and operation.",
          "evidence": "Record the ordered focus stops and any skipped or extra target."
        },
        {
          "id": "key-02",
          "action": "Activate, change and dismiss every interactive state using the keyboard.",
          "expected_observation": "Activation works without pointer input, focus remains visible and no state traps focus.",
          "evidence": "Record key sequence, resulting state and focus destination."
        },
        {
          "id": "key-03",
          "action": "Complete the matched corrected task from entry to confirmation.",
          "expected_observation": "The control completes without borrowing observations from the broken fixture.",
          "evidence": "Record task completion and control-specific observations."
        }
      ],
      "expected_observations": [
        "Focus order, visibility, activation and escape behavior are independently observable.",
        "A blocked step is fail or cannot-tell with evidence, never an inferred pass."
      ],
      "stop_conditions": [
        "Stop if focus enters a state that cannot be escaped with the documented recovery key.",
        "Stop before any route outside the public synthetic fixture host.",
        "Mark unattempted steps not-tested after a blocking failure."
      ],
      "evidence_requirements": [
        "Exact browser, platform, viewport and keyboard layout.",
        "Ordered focus trace and step-level outcome.",
        "Public-synthetic screenshots or notes only."
      ]
    },
    {
      "id": "switch-task",
      "version": "1.0.0",
      "title": "Switch-access task operation",
      "lane": "at-interoperability",
      "fixture_ids": [
        "scenario-dragging_required",
        "scenario-safe_dragging_required",
        "journey-booking-broken",
        "journey-booking-correct"
      ],
      "prerequisites": [
        "Configure the recorded switch interface, scan pattern and activation timing before opening the fixture.",
        "Verify the reviewer can pause or exit scanning at any point.",
        "Reset the fixture and switch scan position before each variant."
      ],
      "environment": {
        "required_fields": ["tool", "tool_version", "browser", "browser_version", "platform", "platform_version", "settings", "input_method"],
        "pairing_options": []
      },
      "steps": [
        {
          "id": "switch-01",
          "action": "Scan from the entry point to each required task control without direct pointer selection.",
          "expected_observation": "Every target enters the scan sequence once in a usable order.",
          "evidence": "Record scan order, missed targets and duplicate stops."
        },
        {
          "id": "switch-02",
          "action": "Activate each control and complete any alternative to dragging or path movement.",
          "expected_observation": "All required operations have a switch-operable action that does not depend on fine path input.",
          "evidence": "Record activation method and resulting state for every step."
        },
        {
          "id": "switch-03",
          "action": "Complete the corrected journey using the same switch configuration.",
          "expected_observation": "The matched control completes under identical timing and scan settings.",
          "evidence": "Record completion, activation count and any abandoned step."
        }
      ],
      "expected_observations": [
        "Reachability and activation are reported separately from task completion.",
        "The exact switch configuration is part of the result scope."
      ],
      "stop_conditions": [
        "Stop if repeated scanning creates discomfort or the reviewer cannot pause the scan safely.",
        "Stop if a destructive action lacks a public-synthetic reset path.",
        "Mark remaining steps not-tested after the reviewer stops."
      ],
      "evidence_requirements": [
        "Switch interface, version, scan mode, timing and input method.",